{
  "$schema": "http://json-schema.org/draft-07/schema#",
  "$id": "eval/multiturn_dialogue_cases.schema.json",
  "title": "EvalCase[] (multiturn_dialogue_cases)",
  "description": "src/data/eval/multiturn_dialogue_cases.json：评测用例",
  "type": "array",
  "minItems": 1,
  "items": {
    "type": "object",
    "additionalProperties": false,
    "required": [
      "id",
      "scenario_name",
      "user_input",
      "background_knowledge",
      "standard_answer",
      "wrong_answer_example",
      "scoring_rubric",
      "information_to_retrieve",
      "information_not_to_invent",
      "risk_points",
      "pass_criteria",
      "failure_analysis",
      "fix_suggestions"
    ],
    "properties": {
      "id": {
        "type": "string",
        "pattern": "^dialog_\\d{3}$"
      },
      "scenario_name": {
        "type": "string",
        "minLength": 1
      },
      "user_input": {
        "type": "array",
        "items": {
          "type": "string",
          "minLength": 1
        },
        "minItems": 1
      },
      "background_knowledge": {
        "type": "string",
        "minLength": 1
      },
      "standard_answer": {
        "type": "string",
        "minLength": 1
      },
      "wrong_answer_example": {
        "type": "string",
        "minLength": 1
      },
      "scoring_rubric": {
        "type": "string",
        "minLength": 1
      },
      "information_to_retrieve": {
        "type": "string",
        "minLength": 1
      },
      "information_not_to_invent": {
        "type": "string",
        "minLength": 1
      },
      "risk_points": {
        "type": "string",
        "minLength": 1
      },
      "pass_criteria": {
        "type": "string",
        "minLength": 1
      },
      "failure_analysis": {
        "type": "string",
        "minLength": 1
      },
      "fix_suggestions": {
        "type": "string",
        "minLength": 1
      }
    }
  }
}
