[
  {
    "id": "dialog_001",
    "scenario_name": "上下文保持-天气查询后续",
    "user_input": [
      "北京今天天气怎么样？",
      "明天呢？",
      "那需要带伞吗？"
    ],
    "background_knowledge": "用户在北京，询问天气并决定是否带伞。模型需保持上下文，知道'明天'指北京明天，'带伞'与降雨概率相关。",
    "standard_answer": "第一轮：北京今天天气晴，气温25-32℃。第二轮：明天北京多云转阴，气温22-28℃。第三轮：明天下午有阵雨，建议带伞。",
    "wrong_answer_example": "第三轮回答时忘记之前讨论的是北京，转而询问用户所在城市。",
    "scoring_rubric": "正确理解指代关系(3分)，信息一致性(3分)，推理带伞与降雨关系(2分)，回答完整性(2分)",
    "information_to_retrieve": "北京天气数据，明天预报，降雨概率",
    "information_not_to_invent": "不应编造具体气象数据，不应虚构天气预警信息",
    "risk_points": "用户可能期望实时数据，模型可能编造天气信息",
    "pass_criteria": "三轮对话中正确保持北京作为讨论城市，最后一轮能关联降雨与带伞建议",
    "failure_analysis": "常见失败：丢失上下文切换城市，不关联降雨与出行建议",
    "fix_suggestions": "强化实体记忆机制，建立推理链条"
  },
  {
    "id": "dialog_002",
    "scenario_name": "话题切换-从工作到娱乐",
    "user_input": [
      "帮我总结一下今天的会议纪要要点",
      "对了，今晚有什么好看的电影推荐吗？",
      "第一部的导演还拍过什么？"
    ],
    "background_knowledge": "用户从工作话题突然切换到娱乐话题，模型需灵活适应。'第一部'指推荐的第一部电影。",
    "standard_answer": "第一轮：总结会议纪要要点。第二轮：推荐几部近期好评电影。第三轮：介绍第一部推荐电影的导演其他作品。",
    "wrong_answer_example": "第二轮仍在讨论会议内容，没有响应话题切换。",
    "scoring_rubric": "话题切换识别(3分)，指代消解(3分)，内容质量(2分)，连贯性(2分)",
    "information_to_retrieve": "会议内容、近期电影信息、导演作品",
    "information_not_to_invent": "不应虚构电影名称或导演履历",
    "risk_points": "话题切换可能导致上下文混乱",
    "pass_criteria": "第二轮正确识别话题切换并给出电影推荐，第三轮正确理解'第一部'指代",
    "failure_analysis": "常见失败：忽视话题切换信号，指代不明",
    "fix_suggestions": "增强话题边界检测能力"
  },
  {
    "id": "dialog_003",
    "scenario_name": "澄清流程-模糊需求",
    "user_input": [
      "帮我写个程序",
      "用Python，处理CSV文件",
      "就是把第一列的日期格式从YYYYMMDD改成YYYY-MM-DD"
    ],
    "background_knowledge": "用户需求逐步澄清，模型应通过追问或等待更多信息来理解需求。",
    "standard_answer": "第一轮：询问用户想用什么语言、处理什么任务。第二轮：进一步询问CSV文件结构和具体处理逻辑。第三轮：给出Python代码实现日期格式转换。",
    "wrong_answer_example": "第一轮就直接给出代码，但方向完全错误。",
    "scoring_rubric": "需求澄清能力(3分)，最终代码正确性(3分)，渐进理解(2分)，交互质量(2分)",
    "information_to_retrieve": "Python CSV处理、日期格式转换",
    "information_not_to_invent": "不应假设CSV文件结构",
    "risk_points": "过早给出答案可能方向错误",
    "pass_criteria": "代码能正确将YYYYMMDD转为YYYY-MM-DD格式",
    "failure_analysis": "常见失败：不等待澄清就假设需求",
    "fix_suggestions": "训练模型在信息不足时主动追问"
  },
  {
    "id": "dialog_004",
    "scenario_name": "渐进披露-复杂问题",
    "user_input": [
      "我想学做饭",
      "从简单的开始",
      "我喜欢吃辣的",
      "不要太复杂的，半小时内能做完的"
    ],
    "background_knowledge": "用户逐步披露偏好：学做饭→简单→辣→快。模型需综合所有条件。",
    "standard_answer": "最终推荐几道30分钟内完成的简单辣味菜品，如辣椒炒肉、麻婆豆腐等。",
    "wrong_answer_example": "推荐了一道需要2小时的复杂川菜。",
    "scoring_rubric": "条件综合(3分)，推荐合理性(3分)，递进理解(2分)，实用性(2分)",
    "information_to_retrieve": "简单辣味菜品、烹饪时间",
    "information_not_to_invent": "不应虚构菜品或烹饪步骤",
    "risk_points": "忽略某个约束条件",
    "pass_criteria": "推荐菜品同时满足简单、辣、30分钟内三个条件",
    "failure_analysis": "常见失败：只满足部分条件",
    "fix_suggestions": "建立多条件筛选机制"
  },
  {
    "id": "dialog_005",
    "scenario_name": "矛盾信息处理",
    "user_input": [
      "我喜欢安静的咖啡馆",
      "推荐一家，最好在三里屯",
      "但是三里屯不是很吵吗？"
    ],
    "background_knowledge": "用户要求安静+三里屯存在矛盾，模型需处理这种冲突。",
    "standard_answer": "承认矛盾，推荐三里屯相对安静的咖啡馆，或建议附近的安静区域。",
    "wrong_answer_example": "忽视矛盾，随便推荐一家三里屯咖啡馆。",
    "scoring_rubric": "矛盾识别(3分)，合理建议(3分)，逻辑一致(2分)，实用性(2分)",
    "information_to_retrieve": "三里屯咖啡馆信息",
    "information_not_to_invent": "不应虚构咖啡馆",
    "risk_points": "忽视用户指出的矛盾",
    "pass_criteria": "能识别并处理安静与三里屯的矛盾",
    "failure_analysis": "常见失败：完全忽视用户指出的矛盾",
    "fix_suggestions": "增强矛盾检测与处理能力"
  },
  {
    "id": "dialog_006",
    "scenario_name": "长对话-旅行规划",
    "user_input": [
      "我想去日本旅行",
      "大概7天左右",
      "预算1万块",
      "东京和大阪都想逛逛",
      "喜欢美食和购物",
      "有什么推荐的行程吗？"
    ],
    "background_knowledge": "多轮渐进披露旅行偏好，最终需要综合所有信息给出行程。",
    "standard_answer": "给出7天日本东京-大阪行程，包含美食购物景点，控制在1万预算内。",
    "wrong_answer_example": "忽略预算推荐高端酒店，或行程超过7天。",
    "scoring_rubric": "信息整合(3分)，行程合理性(3分)，预算控制(2分)，偏好匹配(2分)",
    "information_to_retrieve": "日本旅行信息、机票酒店价格",
    "information_not_to_invent": "不应编造具体价格",
    "risk_points": "遗漏某个约束条件",
    "pass_criteria": "行程同时满足7天、1万预算、东京大阪、美食购物",
    "failure_analysis": "常见失败：忽略预算或时间约束",
    "fix_suggestions": "使用清单式信息追踪"
  },
  {
    "id": "dialog_007",
    "scenario_name": "指代消解-多实体",
    "user_input": [
      "张三和李四谁更适合这个岗位？",
      "张三有5年经验，李四有3年",
      "但是李四学历更高",
      "那你推荐谁？"
    ],
    "background_knowledge": "讨论两个人选的优劣，模型需追踪两个实体的属性。",
    "standard_answer": "综合分析两人优劣，给出推荐并说明理由。",
    "wrong_answer_example": "混淆两人信息，把张三的经验安到李四头上。",
    "scoring_rubric": "实体追踪(3分)，信息准确性(3分)，推理合理(2分)，结论清晰(2分)",
    "information_to_retrieve": "岗位要求、候选人信息",
    "information_not_to_invent": "不应编造候选人信息",
    "risk_points": "混淆实体属性",
    "pass_criteria": "准确区分张三李四的信息并综合分析",
    "failure_analysis": "常见失败：实体属性混淆",
    "fix_suggestions": "强化实体属性追踪"
  },
  {
    "id": "dialog_008",
    "scenario_name": "多步任务-数据分析",
    "user_input": [
      "帮我分析这份销售数据",
      "先看总销售额",
      "再按区域分一下",
      "哪个区域增长最快？",
      "最后做个简单的趋势预测"
    ],
    "background_knowledge": "多步骤数据分析任务，每步依赖前一步结果。",
    "standard_answer": "逐步完成：总销售额→区域分析→增长对比→趋势预测。",
    "wrong_answer_example": "跳过中间步骤直接给预测结果。",
    "scoring_rubric": "步骤完整性(3分)，分析准确性(3分)，逻辑连贯(2分)，结果可用(2分)",
    "information_to_retrieve": "销售数据分析方法",
    "information_not_to_invent": "不应编造数据结果",
    "risk_points": "跳过步骤或逻辑断裂",
    "pass_criteria": "每步分析结果正确且步骤完整",
    "failure_analysis": "常见失败：跳过步骤或结果不一致",
    "fix_suggestions": "建立任务分解机制"
  },
  {
    "id": "dialog_009",
    "scenario_name": "澄清流程-专业术语",
    "user_input": [
      "什么是RAG？",
      "它和传统的检索有什么区别？",
      "在实际应用中怎么实现？",
      "有没有开源的框架推荐？"
    ],
    "background_knowledge": "用户逐步深入了解RAG技术，从概念到实践。",
    "standard_answer": "从RAG定义→与传统检索区别→实现方法→开源框架，逐步深入。",
    "wrong_answer_example": "第一轮就给出过于技术化的回答，不适合初学者。",
    "scoring_rubric": "知识深度递进(3分)，准确性(3分)，易懂性(2分)，实用性(2分)",
    "information_to_retrieve": "RAG技术资料",
    "information_not_to_invent": "不应虚构框架名称",
    "risk_points": "深度与用户水平不匹配",
    "pass_criteria": "回答深度逐步递进，内容准确",
    "failure_analysis": "常见失败：深度不递进或信息过时",
    "fix_suggestions": "根据用户追问调整深度"
  },
  {
    "id": "dialog_010",
    "scenario_name": "上下文保持-代词指代",
    "user_input": [
      "我买了一台新电脑",
      "它的性能怎么样？",
      "能玩3A游戏吗？"
    ],
    "background_knowledge": "用户买了新电脑，后续的'它'指代这台电脑。",
    "standard_answer": "第一轮：询问配置。第二轮：基于配置评估性能。第三轮：评估游戏能力。",
    "wrong_answer_example": "不知道'它'指什么，反问用户。",
    "scoring_rubric": "代词消解(3分)，推理准确(3分)，实用性(2分)，连贯性(2分)",
    "information_to_retrieve": "电脑硬件性能知识",
    "information_not_to_invent": "不应编造性能数据",
    "risk_points": "代词指代失败",
    "pass_criteria": "正确理解'它'指代新电脑",
    "failure_analysis": "常见失败：代词消解失败",
    "fix_suggestions": "强化代词消解能力"
  },
  {
    "id": "dialog_011",
    "scenario_name": "话题切换-情绪支持",
    "user_input": [
      "今天工作好累啊",
      "老板又给我加了好多活",
      "你说我是不是该跳槽？"
    ],
    "background_knowledge": "用户从抱怨情绪过渡到职业决策咨询。",
    "standard_answer": "先共情，再理性分析跳槽利弊，不做绝对建议。",
    "wrong_answer_example": "冷冰冰地分析跳槽利弊，忽视情绪。",
    "scoring_rubric": "情绪识别(3分)，建议合理(3分)，共情能力(2分)，平衡性(2分)",
    "information_to_retrieve": "职业发展建议",
    "information_not_to_invent": "不应虚构行业薪资数据",
    "risk_points": "忽视情绪需求",
    "pass_criteria": "先共情再给建议，不替用户做决定",
    "failure_analysis": "常见失败：纯理性分析无共情",
    "fix_suggestions": "增强情感识别与回应能力"
  },
  {
    "id": "dialog_012",
    "scenario_name": "渐进披露-产品需求",
    "user_input": [
      "我要做一个网站",
      "是一个电商网站",
      "主要卖衣服",
      "需要支持微信支付",
      "还要有会员系统"
    ],
    "background_knowledge": "用户逐步披露产品需求，最终是服装电商网站。",
    "standard_answer": "综合所有需求给出技术方案建议。",
    "wrong_answer_example": "忽略支付或会员需求，只做基础网站方案。",
    "scoring_rubric": "需求整合(3分)，方案可行性(3分)，技术选型(2分)，完整性(2分)",
    "information_to_retrieve": "电商网站技术栈",
    "information_not_to_invent": "不应虚构技术框架",
    "risk_points": "遗漏需求",
    "pass_criteria": "方案覆盖所有提及的需求",
    "failure_analysis": "常见失败：遗漏会员系统或支付需求",
    "fix_suggestions": "建立需求追踪清单"
  },
  {
    "id": "dialog_013",
    "scenario_name": "矛盾信息-价格预期",
    "user_input": [
      "我想买一部手机",
      "预算2000",
      "但是拍照一定要好",
      "处理器也要旗舰级的"
    ],
    "background_knowledge": "用户要求旗舰配置但预算有限，存在矛盾。",
    "standard_answer": "指出2000元预算与旗舰配置的矛盾，推荐性价比最高的选项或建议调整预算。",
    "wrong_answer_example": "推荐一部6000元的旗舰机。",
    "scoring_rubric": "矛盾识别(3分)，推荐合理(3分)，建议实用性(2分)，沟通技巧(2分)",
    "information_to_retrieve": "手机市场行情",
    "information_not_to_invent": "不应虚构手机型号或价格",
    "risk_points": "推荐超出预算",
    "pass_criteria": "推荐在预算范围内或合理说明调整建议",
    "failure_analysis": "常见失败：完全无视预算约束",
    "fix_suggestions": "建立约束条件检查机制"
  },
  {
    "id": "dialog_014",
    "scenario_name": "长对话-代码调试",
    "user_input": [
      "我的Python代码报错了",
      "报错信息是IndexError: list index out of range",
      "代码是这样的：for i in range(len(lst)+1): print(lst[i])",
      "我怎么改？"
    ],
    "background_knowledge": "用户提供错误信息和代码，需要诊断并修复。",
    "standard_answer": "诊断：range(len(lst)+1)导致最后一个索引越界。修复：改为range(len(lst))。",
    "wrong_answer_example": "给出无关的修复方案，如try-except。",
    "scoring_rubric": "诊断准确(3分)，修复正确(3分)，解释清晰(2分)，额外建议(2分)",
    "information_to_retrieve": "Python列表索引知识",
    "information_not_to_invent": "不应虚构Python行为",
    "risk_points": "修复方案不正确",
    "pass_criteria": "正确识别range(len(lst)+1)为错误原因",
    "failure_analysis": "常见失败：诊断错误原因不准确",
    "fix_suggestions": "增强代码诊断能力"
  },
  {
    "id": "dialog_015",
    "scenario_name": "上下文保持-多轮修改",
    "user_input": [
      "帮我写一封邮件，主题是项目进度汇报",
      "语气正式一点",
      "加上附件说明",
      "收件人改成王总",
      "最后再加一句期待回复"
    ],
    "background_knowledge": "用户多轮修改邮件，每次修改都基于前一版本。",
    "standard_answer": "每轮修改后给出更新版本，保持之前内容并加入新要求。",
    "wrong_answer_example": "每次都写一封全新邮件，丢失之前的要求。",
    "scoring_rubric": "增量修改(3分)，信息保持(3分)，格式正确(2分)，完整度(2分)",
    "information_to_retrieve": "商务邮件写作规范",
    "information_not_to_invent": "不应编造邮件内容",
    "risk_points": "丢失之前的修改",
    "pass_criteria": "最终版本包含所有五轮要求",
    "failure_analysis": "常见失败：增量修改失败，丢失早期要求",
    "fix_suggestions": "建立版本追踪机制"
  },
  {
    "id": "dialog_016",
    "scenario_name": "澄清流程-翻译需求",
    "user_input": [
      "帮我翻译一段话",
      "从中文翻成英文",
      "是学术论文的摘要",
      "大概200字左右"
    ],